{
  "version": 19,
  "updated_at": "2026-10-15",
  "defaults": {
    "asr": {
      "rate": 16000,
      "channel": 1,
      "format": "pcm",
      "bits": 16,
      "stream_simulate": true,
      "hotword_replace": true,
      "hotword_llm_mode": "auto",
      "punctuation_mode": "auto",
      "num_threads": 2,
      "provider": "cpu"
    },
    "vad": {
      "threshold": 0.5,
      "min_silence_duration": 0.2,
      "min_speech_duration": 0.2,
      "max_speech_duration": 10.0
    }
  },
  "models": [
    {
      "id": "doubao-streaming",
      "type": "online",
      "category": "asr",
      "engine": "volcengine",
      "name": "火山引擎 - 豆包流式语音识别模型2.0",
      "description": "¥1 / 小时，中文用户首选",
      "tags": ["流式输出", "免费试用额度", "热词库", "中英文,方言"],
      "capabilities": {
        "streaming": true,
        "hotwords": true,
        "punctuation": true,
        "itn": true
      },
      "default_config": {
        "url": "wss://openspeech.bytedance.com/api/v3/sauc/bigmodel_async",
        "auth_mode": "legacy",
        "app_id": "",
        "access_token": "",
        "resource_id": "volc.seedasr.sauc.duration",
        "api_key": "",
        "format": "pcm",
        "rate": 16000,
        "bits": 16,
        "channel": 1,
        "model_name": "bigmodel",
        "model_version": "400",
        "operation": "submit",
        "sequence": 0,
        "language": "",
        "enable_ddc": true,
        "enable_itn": true,
        "enable_nonstream": true,
        "enable_punc": true,
        "show_utterances": true,
        "result_type": "full",
        "enable_accelerate_text": true,
        "accelerate_score": 10,
        "ssd_version": "200",
        "output_zh_variant": "off",
        "end_window_size": 800,
        "force_to_speech_time": 1000,
        "vad_segment_duration": 3000,
        "corpus": {
          "boosting_table_id": "",
          "correct_table_id": ""
        }
      },
      "name_en": "Volcano Engine — Doubao streaming ASR 2.0",
      "description_en": "¥1/hour, first choice for Chinese",
      "tags_en": ["Streaming", "Free trial", "Hotwords", "Chinese + English, dialects"]
    },
    {
      "id": "elevenlabs-realtime",
      "type": "online",
      "category": "asr",
      "engine": "elevenlabs",
      "name": "ElevenLabs - Scribe v2 Realtime",
      "description": "$0.39 / 小时",
      "tags": ["流式输出", "90+多语言", "按量计费"],
      "capabilities": {
        "streaming": true,
        "hotwords": true,
        "punctuation": true,
        "itn": true
      },
      "requires_config": ["api_key"],
      "default_config": {
        "api_key": "",
        "language": "",
        "filter_background_audio": false,
        "enable_ddc": true,
        "commit_strategy": "vad",
        "vad_silence_threshold_secs": 1.5,
        "vad_threshold": 0.4,
        "min_speech_duration_ms": 100,
        "min_silence_duration_ms": 100,
        "secondary_languages": [],
        "transcript_edit": "",
        "enable_keyterms": false
      },
      "name_en": "ElevenLabs — Scribe v2 Realtime",
      "description_en": "$0.39/hour",
      "tags_en": ["Streaming", "90+ languages", "Pay-as-you-go"]
    },
    {
      "id": "silero-vad",
      "type": "offline",
      "category": "vad",
      "engine": "sherpa-onnx",
      "name": "Silero VAD",
      "description": "语音活动检测模型，语音分段的基础依赖",
      "tags": ["基础模型"],
      "architecture": "vad",
      "download_url": "https://github.com/k2-fsa/sherpa-onnx/releases/download/asr-models/silero_vad.onnx",
      "file_size": 2,
      "mem_size": 50,
      "model_files": {
        "model": "silero_vad.onnx"
      },
      "default_config": {
        "threshold": 0.5,
        "min_silence_duration": 0.2,
        "min_speech_duration": 0.2,
        "max_speech_duration": 10.0
      },
      "name_en": "Silero VAD",
      "description_en": "Voice activity detection model, the basis for speech segmentation",
      "tags_en": ["Base model"]
    },
    {
      "id": "sherpa-onnx-sense-voice-zh-en-ja-ko-yue-int8",
      "type": "offline",
      "category": "asr",
      "engine": "sherpa-onnx",
      "name": "SenseVoice 多语言",
      "description": "高精度离线模型，支持中英日韩粤 5种语言",
      "tags": ["中文识别率高", "低延时", "低内存占用"],
      "capabilities": {
        "streaming": false,
        "hotwords": false,
        "punctuation": false,
        "itn": false
      },
      "architecture": "sense_voice",
      "download_url": "https://github.com/k2-fsa/sherpa-onnx/releases/download/asr-models/sherpa-onnx-sense-voice-zh-en-ja-ko-yue-int8-2025-09-09.tar.bz2",
      "file_size": 158,
      "mem_size": 600,
      "model_files": {
        "model": "model.int8.onnx",
        "tokens": "tokens.txt"
      },
      "default_config": {
        "use_itn": true,
        "language": "auto"
      },
      "name_en": "SenseVoice multilingual",
      "description_en": "High-accuracy offline model for Chinese, English, Japanese, Korean, and Cantonese",
      "tags_en": ["High Chinese accuracy", "Low latency", "Low memory"]
    },
    {
      "id": "sherpa-onnx-funasr-nano-zh-en-ja-int8",
      "type": "offline",
      "category": "asr",
      "engine": "sherpa-onnx",
      "name": "FunASR-Nano 中英日三语",
      "description": "基于 FunASR-Nano-2512 的高精度离线模型，支持中英日三语、多种方言及歌词识别",
      "tags": ["中英日, 方言", "歌词识别", "中文识别高"],
      "capabilities": {
        "streaming": false,
        "hotwords": true,
        "punctuation": true,
        "itn": true
      },
      "architecture": "funasr_nano",
      "download_url": "https://github.com/k2-fsa/sherpa-onnx/releases/download/asr-models/sherpa-onnx-funasr-nano-int8-2025-12-30.tar.bz2",
      "file_size": 948,
      "mem_size": 2000,
      "model_files": {
        "encoder_adaptor": "encoder_adaptor.int8.onnx",
        "llm": "llm.int8.onnx",
        "embedding": "embedding.int8.onnx",
        "tokenizer": "Qwen3-0.6B"
      },
      "default_config": {
        "system_prompt": "You are a helpful assistant.",
        "user_prompt": "语音转写：",
        "max_new_tokens": 512,
        "temperature": 1e-6,
        "top_p": 0.8,
        "seed": 42,
        "language": "auto",
        "itn": true
      },
      "name_en": "FunASR-Nano Chinese/English/Japanese",
      "description_en": "High-accuracy offline model based on FunASR-Nano-2512; Chinese, English, Japanese, dialects, and lyrics",
      "tags_en": ["Chinese/English/Japanese, dialects", "Lyrics", "High Chinese accuracy"]
    },
    {
      "id": "sherpa-onnx-streaming-zipformer-zh-en",
      "type": "offline",
      "category": "asr",
      "engine": "sherpa-onnx",
      "name": "Zipformer 流式中英双语",
      "description": "实时流式本地模型，支持中英双语低延迟识别",
      "tags": ["中英混说", "低延时", "低内存占用"],
      "capabilities": {
        "streaming": true,
        "hotwords": true,
        "punctuation": false,
        "itn": false
      },
      "architecture": "transducer",
      "download_url": "https://github.com/k2-fsa/sherpa-onnx/releases/download/asr-models/sherpa-onnx-streaming-zipformer-bilingual-zh-en-2023-02-20.tar.bz2",
      "file_size": 150,
      "mem_size": 500,
      "model_files": {
        "encoder": "encoder-epoch-99-avg-1.int8.onnx",
        "decoder": "decoder-epoch-99-avg-1.onnx",
        "joiner": "joiner-epoch-99-avg-1.int8.onnx",
        "tokens": "tokens.txt",
        "bpe_vocab": "bpe.vocab"
      },
      "default_config": {
        "max_active_paths": 16,
        "modeling_unit": "cjkchar+bpe",
        "enable_endpoint": true,
        "rule1_min_trailing_silence": 2.4,
        "rule2_min_trailing_silence": 0.8,
        "rule3_min_utterance_length": 20
      },
      "name_en": "Zipformer streaming Chinese/English",
      "description_en": "Real-time local streaming model for Chinese and English with low latency",
      "tags_en": ["Mixed Chinese/English", "Low latency", "Low memory"]
    },
    {
      "id": "sherpa-onnx-streaming-zipformer-zh-int8",
      "type": "offline",
      "category": "asr",
      "engine": "sherpa-onnx",
      "name": "Zipformer 流式中文",
      "description": "实时流式本地模型，中文高精度低延迟识别",
      "tags": ["低延时", "低内存占用"],
      "capabilities": {
        "streaming": true,
        "hotwords": true,
        "punctuation": false,
        "itn": false
      },
      "architecture": "transducer",
      "download_url": "https://github.com/k2-fsa/sherpa-onnx/releases/download/asr-models/sherpa-onnx-streaming-zipformer-zh-int8-2025-06-30.tar.bz2",
      "file_size": 160,
      "mem_size": 500,
      "model_files": {
        "encoder": "encoder.int8.onnx",
        "decoder": "decoder.onnx",
        "joiner": "joiner.int8.onnx",
        "tokens": "tokens.txt"
      },
      "default_config": {
        "max_active_paths": 16,
        "modeling_unit": "cjkchar",
        "enable_endpoint": true,
        "rule1_min_trailing_silence": 2.4,
        "rule2_min_trailing_silence": 1.2,
        "rule3_min_utterance_length": 0
      },
      "name_en": "Zipformer streaming Chinese",
      "description_en": "Real-time local streaming model for high-accuracy, low-latency Chinese",
      "tags_en": ["Low latency", "Low memory"]
    },
    {
      "id": "sherpa-onnx-qwen3-asr-0.6B-int8",
      "type": "offline",
      "category": "asr",
      "engine": "sherpa-onnx",
      "name": "Qwen3 ASR 多语言",
      "description": "基于 Qwen3-ASR-0.6B 的多语言语音识别模型，支持31种语言及20种中文方言、歌词/说唱识别",
      "tags": ["多语言", "中英混说", "中文识别率高"],
      "capabilities": {
        "streaming": false,
        "hotwords": true,
        "punctuation": true,
        "itn": false
      },
      "architecture": "qwen3_asr",
      "download_url": "https://github.com/k2-fsa/sherpa-onnx/releases/download/asr-models/sherpa-onnx-qwen3-asr-0.6B-int8-2026-03-25.tar.bz2",
      "file_size": 938,
      "mem_size": 2500,
      "model_files": {
        "conv_frontend": "conv_frontend.onnx",
        "encoder": "encoder.int8.onnx",
        "decoder": "decoder.int8.onnx",
        "tokenizer": "tokenizer"
      },
      "default_config": {
        "max_total_len": 512,
        "max_new_tokens": 128,